<?xml version="1.0" encoding="UTF-8"?>
<clients xmlns="myTargetNameSpaceName" 
    xmlns:xsi="http://www.w3.org/2001/XMLSchema-instance" 
    xsi:schemaLocation="myTargetNameSpaceName clientContactsNamespace.xsd">
   
  <client>
    <name>Jack</name>
    <contact>
      <telNo>011 726 4860</telNo>
      <eMail>Jack@Jill.org.za</eMail>
    </contact>
  </client>
     
  <client>
    <name>Jill</name>
    <contact>
      <telNo>011 726 4860</telNo>
      <eMail>Jill@Jack.org.za</eMail>
    </contact>
  </client>
  
</clients>
